{
  "snapshot_provenance_version": "0.1.0",
  "provider": "TÜİK",
  "source_name": "İç Göç İstatistikleri, 2021-2025",
  "snapshot_version": "tuik-internal-migration-2021-2025-v1",
  "retrieved_at": "2026-08-15",
  "license": "TÜİK verileri kaynak gösterilerek yeniden kullanılabilir.",
  "license_url": "https://www.tuik.gov.tr/Kurumsal/Yasal_Uyari",
  "data_file": "migration_2021_2025.csv",
  "sources": [
    {
      "raw_file": "raw/migration_2021.xls",
      "sha256": "37671f5eb3f5ecf5296536e27a4768adc20a5ffaf8f2c1f5c22a488ad5b3e74b",
      "release_id": "45869",
      "source_url": "https://veriportali.tuik.gov.tr/tr/press/45869",
      "release_date": "2022-12-28",
      "label": "2021",
      "source_name": "İç Göç İstatistikleri, 2021"
    },
    {
      "raw_file": "raw/migration_2022.xls",
      "sha256": "9e2ea07423628964b70b48e672363cb76110d2910e17293cc17e67dab295aa1b",
      "release_id": "49727",
      "source_url": "https://veriportali.tuik.gov.tr/tr/press/49727",
      "release_date": "2023-08-14",
      "label": "2022",
      "source_name": "İç Göç İstatistikleri, 2022"
    },
    {
      "raw_file": "raw/migration_2023.xls",
      "sha256": "f5f99551e9081ed9cceb8306a24470b72a354ca692b5fb395a82f78213ed4502",
      "release_id": "53676",
      "source_url": "https://veriportali.tuik.gov.tr/tr/press/53676",
      "release_date": "2024-08-14",
      "label": "2023",
      "source_name": "İç Göç İstatistikleri, 2023"
    },
    {
      "raw_file": "raw/migration_2024.xls",
      "sha256": "85a4e24c58167866242d33dbfedfe1e6ceccedba359b5f91f0fa9c306ece8710",
      "release_id": "54082",
      "source_url": "https://veriportali.tuik.gov.tr/tr/press/54082",
      "release_date": "2025-07-14",
      "label": "2024",
      "source_name": "İç Göç İstatistikleri, 2024"
    },
    {
      "raw_file": "raw/migration_2025.xls",
      "sha256": "3baefd6625110dec67a60ae1be3d9ca10ddc757b604c51d1893b5c3cd5dedc76",
      "release_id": "58139",
      "source_url": "https://veriportali.tuik.gov.tr/tr/press/58139",
      "release_date": "2026-07-14",
      "label": "2025",
      "source_name": "İç Göç İstatistikleri, 2025"
    }
  ],
  "transformation_notes": [
    "Tablo: İllerin aldığı göç, verdiği göç, net göç ve net göç hızı.",
    "Beş resmî XLS tablosundaki 81 il satırı sabit sütun adlarıyla UTF-8 CSV'ye aktarılmıştır.",
    "Kişi sayıları tamsayı; net göç hızı kaynak hücrelerin görüntüleme hassasiyetiyle bir ondalık basamak olarak saklanmıştır.",
    "Kapsam: 2021-2025, yıl başına 81 il; in_migration/out_migration/net_migration kişi, net_migration_rate binde.",
    "Kaynak gösterimi: Türkiye İstatistik Kurumu (TÜİK), İç Göç İstatistikleri, 2021-2025.",
    "Executor yalnızca yerel CSV ve provenance dosyasını okur; çalışma zamanında ağ çağrısı yapmaz.",
    "Dönüşüm scripti: scripts/snapshots/demography_labor_tuik.py; beş ham XLS dosyasından bu CSV'yi deterministik olarak üretir."
  ]
}
